{"schemaVersion":1,"reportId":"validation-fixture","validatorVersion":"1","packageId":"fixture-map","revisionId":"fixture-map","mappingApprovalHash":"63bc47c1bc4ffc78a01d55c4ef3536aa777ec218eec3fff04fb06816455ef12d","packageContentHash":"d643bff5f1ae5685ea50e9cda59e01f82477e50ca5e89c88006ae1420c5d7980","reviewEvidenceHash":"5145762e780af382523bcbaa502707243e8d3737cbb1f66ffafa4bbfe5154223","checks":[{"id":"fixture","passed":true}],"deviations":[],"passed":true,"createdAt":"2026-09-28T00:00:00Z"}
